{
  "schema": "mayak.report/1",
  "report_id": "b7c1e0a4f2",
  "ts": "2026-10-13T12:30:00Z",
  "agent": {
    "ver": "0.3",
    "os": "linux",
    "source": "cli"
  },
  "net": {
    "ip_ver": 4,
    "resolver": "isp",
    "country": "RU",
    "region": null
  },
  "targets_rev": "2026-10-12.1",
  "results": []
}
